[
  {
    "id": "alert-1",
    "tier": "2c",
    "severity": "high",
    "lap": 1,
    "title": "Brake caliper drift",
    "message": "Left front brake caliper may be sticking. Generating excess heat that is transferring into the tyre.",
    "status": "pending",
    "created_at": 45,
    "sigma": 3.1,
    "channels": [
      {
        "name": "brake_temp_fl",
        "sigma": 3.1
      },
      {
        "name": "tyre_temp_fl",
        "sigma": 1.8
      }
    ],
    "recommendation": "Reduce braking T1 and T4. Rear bias up two clicks. Monitor two laps, box if no improvement."
  },
  {
    "id": "alert-2",
    "tier": "2b",
    "severity": "medium",
    "lap": 2,
    "title": "ERS harvest decline",
    "message": "Harvest 2.5 MJ, below the 5.0 MJ floor. Brake later into the heavy zones.",
    "status": "sent",
    "created_at": 64.2
  },
  {
    "id": "alert-3",
    "tier": "2b",
    "severity": "medium",
    "lap": 2,
    "title": "Tyre asymmetry",
    "message": "Front axle split 15°C. Left front working harder than the right.",
    "status": "sent",
    "created_at": 102.8
  },
  {
    "id": "alert-5",
    "tier": "2c",
    "severity": "medium",
    "lap": 3,
    "title": "ERS state of charge decay",
    "message": "State of charge is declining faster than the deployment model predicts across the last four laps.",
    "status": "pending",
    "created_at": 140.1,
    "sigma": 2.6,
    "channels": [
      {
        "name": "ers_soc_pct",
        "sigma": 2.6
      }
    ],
    "recommendation": "Switch to balanced deploy through S2 and rebuild charge before the pit window."
  },
  {
    "id": "alert-6",
    "tier": "2a",
    "severity": "low",
    "lap": 5,
    "title": "Brake temp check",
    "message": "Brakes 660° front, 415° rear. In window.",
    "status": "sent",
    "created_at": 252.6
  },
  {
    "id": "alert-7",
    "tier": "2c",
    "severity": "high",
    "lap": 5,
    "title": "Rear axle temperature divergence",
    "message": "Rear axle running hotter than the traction model expects for this fuel load and track temp.",
    "status": "pending",
    "created_at": 253.2,
    "sigma": 2.9,
    "channels": [
      {
        "name": "tyre_temp_rl",
        "sigma": 2.9
      },
      {
        "name": "tyre_temp_rr",
        "sigma": 2.2
      }
    ],
    "recommendation": "Short shift out of T6 and T9. Protect the rears for the next three laps."
  },
  {
    "id": "alert-9",
    "tier": "2c",
    "severity": "medium",
    "lap": 7,
    "title": "Fuel flow instability",
    "message": "Fuel flow rate oscillating outside the normal band on throttle application.",
    "status": "pending",
    "created_at": 384.2,
    "sigma": 2.4,
    "channels": [
      {
        "name": "fuel_flow_kgh",
        "sigma": 2.4
      }
    ],
    "recommendation": "Smoother throttle pickup out of the slow corners."
  },
  {
    "id": "alert-10",
    "tier": "2b",
    "severity": "medium",
    "lap": 8,
    "title": "ERS harvest decline",
    "message": "Harvest 2.7 MJ, below the 5.0 MJ floor. Brake later into the heavy zones.",
    "status": "sent",
    "created_at": 441
  },
  {
    "id": "alert-11",
    "tier": "2b",
    "severity": "medium",
    "lap": 8,
    "title": "Tyre asymmetry",
    "message": "Front axle split 15°C. Left front working harder than the right.",
    "status": "sent",
    "created_at": 479.5
  },
  {
    "id": "alert-13",
    "tier": "2c",
    "severity": "high",
    "lap": 9,
    "title": "Brake caliper drift",
    "message": "Left front brake caliper may be sticking. Generating excess heat that is transferring into the tyre.",
    "status": "pending",
    "created_at": 533.2,
    "sigma": 3.1,
    "channels": [
      {
        "name": "brake_temp_fl",
        "sigma": 3.1
      },
      {
        "name": "tyre_temp_fl",
        "sigma": 1.8
      }
    ],
    "recommendation": "Reduce braking T1 and T4. Rear bias up two clicks. Monitor two laps, box if no improvement."
  },
  {
    "id": "alert-14",
    "tier": "2a",
    "severity": "low",
    "lap": 10,
    "title": "Brake temp check",
    "message": "Brakes 656° front, 413° rear. In window.",
    "status": "sent",
    "created_at": 566.6
  },
  {
    "id": "alert-15",
    "tier": "2c",
    "severity": "medium",
    "lap": 10,
    "title": "ERS state of charge decay",
    "message": "State of charge is declining faster than the deployment model predicts across the last four laps.",
    "status": "pending",
    "created_at": 628.2,
    "sigma": 2.6,
    "channels": [
      {
        "name": "ers_soc_pct",
        "sigma": 2.6
      }
    ],
    "recommendation": "Switch to balanced deploy through S2 and rebuild charge before the pit window."
  },
  {
    "id": "alert-17",
    "tier": "2c",
    "severity": "high",
    "lap": 12,
    "title": "Rear axle temperature divergence",
    "message": "Rear axle running hotter than the traction model expects for this fuel load and track temp.",
    "status": "pending",
    "created_at": 741.2,
    "sigma": 2.9,
    "channels": [
      {
        "name": "tyre_temp_rl",
        "sigma": 2.9
      },
      {
        "name": "tyre_temp_rr",
        "sigma": 2.2
      }
    ],
    "recommendation": "Short shift out of T6 and T9. Protect the rears for the next three laps."
  },
  {
    "id": "alert-18",
    "tier": "2b",
    "severity": "medium",
    "lap": 14,
    "title": "ERS harvest decline",
    "message": "Harvest 2.7 MJ, below the 5.0 MJ floor. Brake later into the heavy zones.",
    "status": "sent",
    "created_at": 817.8
  },
  {
    "id": "alert-19",
    "tier": "2b",
    "severity": "medium",
    "lap": 14,
    "title": "Tyre asymmetry",
    "message": "Front axle split 15°C. Left front working harder than the right.",
    "status": "sent",
    "created_at": 856.4
  },
  {
    "id": "alert-20",
    "tier": "2c",
    "severity": "medium",
    "lap": 14,
    "title": "Fuel flow instability",
    "message": "Fuel flow rate oscillating outside the normal band on throttle application.",
    "status": "pending",
    "created_at": 872.2,
    "sigma": 2.4,
    "channels": [
      {
        "name": "fuel_flow_kgh",
        "sigma": 2.4
      }
    ],
    "recommendation": "Smoother throttle pickup out of the slow corners."
  },
  {
    "id": "alert-21",
    "tier": "2a",
    "severity": "low",
    "lap": 15,
    "title": "Brake temp check",
    "message": "Brakes 660° front, 414° rear. In window.",
    "status": "sent",
    "created_at": 880.6
  },
  {
    "id": "alert-23",
    "tier": "2c",
    "severity": "high",
    "lap": 17,
    "title": "Brake caliper drift",
    "message": "Left front brake caliper may be sticking. Generating excess heat that is transferring into the tyre.",
    "status": "pending",
    "created_at": 1021.2,
    "sigma": 3.1,
    "channels": [
      {
        "name": "brake_temp_fl",
        "sigma": 3.1
      },
      {
        "name": "tyre_temp_fl",
        "sigma": 1.8
      }
    ],
    "recommendation": "Reduce braking T1 and T4. Rear bias up two clicks. Monitor two laps, box if no improvement."
  },
  {
    "id": "alert-25",
    "tier": "2c",
    "severity": "medium",
    "lap": 18,
    "title": "ERS state of charge decay",
    "message": "State of charge is declining faster than the deployment model predicts across the last four laps.",
    "status": "pending",
    "created_at": 1116.3,
    "sigma": 2.6,
    "channels": [
      {
        "name": "ers_soc_pct",
        "sigma": 2.6
      }
    ],
    "recommendation": "Switch to balanced deploy through S2 and rebuild charge before the pit window."
  },
  {
    "id": "alert-26",
    "tier": "2a",
    "severity": "low",
    "lap": 20,
    "title": "Brake temp check",
    "message": "Brakes 660° front, 415° rear. In window.",
    "status": "sent",
    "created_at": 1194.6
  },
  {
    "id": "alert-27",
    "tier": "2b",
    "severity": "medium",
    "lap": 20,
    "title": "ERS harvest decline",
    "message": "Harvest 2.7 MJ, below the 5.0 MJ floor. Brake later into the heavy zones.",
    "status": "sent",
    "created_at": 1194.6
  },
  {
    "id": "alert-28",
    "tier": "2c",
    "severity": "high",
    "lap": 20,
    "title": "Rear axle temperature divergence",
    "message": "Rear axle running hotter than the traction model expects for this fuel load and track temp.",
    "status": "pending",
    "created_at": 1229.4,
    "sigma": 2.9,
    "channels": [
      {
        "name": "tyre_temp_rl",
        "sigma": 2.9
      },
      {
        "name": "tyre_temp_rr",
        "sigma": 2.2
      }
    ],
    "recommendation": "Short shift out of T6 and T9. Protect the rears for the next three laps."
  },
  {
    "id": "alert-29",
    "tier": "2b",
    "severity": "medium",
    "lap": 20,
    "title": "Tyre asymmetry",
    "message": "Front axle split 15°C. Left front working harder than the right.",
    "status": "sent",
    "created_at": 1233.1
  },
  {
    "id": "alert-31",
    "tier": "2c",
    "severity": "medium",
    "lap": 22,
    "title": "Fuel flow instability",
    "message": "Fuel flow rate oscillating outside the normal band on throttle application.",
    "status": "pending",
    "created_at": 1360.5,
    "sigma": 2.4,
    "channels": [
      {
        "name": "fuel_flow_kgh",
        "sigma": 2.4
      }
    ],
    "recommendation": "Smoother throttle pickup out of the slow corners."
  },
  {
    "id": "alert-33",
    "tier": "2a",
    "severity": "low",
    "lap": 25,
    "title": "Brake temp check",
    "message": "Brakes 660° front, 415° rear. In window.",
    "status": "sent",
    "created_at": 1508.6
  },
  {
    "id": "alert-34",
    "tier": "2c",
    "severity": "high",
    "lap": 25,
    "title": "Brake caliper drift",
    "message": "Left front brake caliper may be sticking. Generating excess heat that is transferring into the tyre.",
    "status": "pending",
    "created_at": 1509.6,
    "sigma": 3.1,
    "channels": [
      {
        "name": "brake_temp_fl",
        "sigma": 3.1
      },
      {